<?xml version="1.0" encoding="ISO-8859-1" ?>
<!DOCTYPE program [
<!ATTLIST program name CDATA #REQUIRED>
<!ELEMENT program (cfgs,srcfile*)>
<!ELEMENT cfgs (cfg*)>
<!ATTLIST cfg
   id ID #REQUIRED
   main CDATA #IMPLIED
   name CDATA #IMPLIED>
<!ELEMENT cfg (bb+)>
<!ATTLIST bb id ID #REQUIRED>
<!ELEMENT bb (prec?,inst*,succ?)>
<!ELEMENT prec (link+)>
<!ELEMENT succ (link+)>
<!ATTLIST link
   type (taken|nottaken|call) #REQUIRED
   cfg IDREF #REQUIRED
   bb IDREF #REQUIRED
   cond CDATA #IMPLIED>
<!ELEMENT link EMPTY>
<!ATTLIST inst
   src IDREF #IMPLIED
   line CDATA #IMPLIED
   addr CDATA #REQUIRED
   type (ipoint|label|op|jump|branch|call|ret) #IMPLIED
   name CDATA #IMPLIED
   operands CDATA #IMPLIED
   cond CDATA #IMPLIED>
<!ELEMENT inst EMPTY>
<!ATTLIST srcfile
   id ID #REQUIRED
   name CDATA #IMPLIED>
<!ELEMENT srcfile (#PCDATA)>
]>

<program name="main">
   <cfgs>
      <cfg id="c6" name="gnc__passive__opcs__compute" main="true">
         <bb id="c6b1">
            <inst addr="0x40030890" src="s1" line="11"/>
            <inst addr="0x40030894"/>
            <inst addr="0x40030898" src="s1" line="12"/>
            <inst addr="0x4003089C" src="s1" line="14"/>
            <inst addr="0x400308A0"/>
            <inst addr="0x400308A4"/>
            <inst addr="0x400308A8" src="s1" line="15"/>
            <inst addr="0x400308AC"/>
            <inst addr="0x400308B0"/>
            <inst addr="0x400308B4" src="s1" line="16"/>
            <succ>
               <link type="nottaken" cfg="c6" bb="c6b2"/>
            </succ>
         </bb>
         <bb id="c6b2">
            <prec>
               <link type="nottaken" cfg="c6" bb="c6b1"/>
               <link type="nottaken" cfg="c6" bb="c6b12"/>
            </prec>
            <inst addr="0x400308B8"/>
            <inst addr="0x400308BC"/>
            <inst addr="0x400308C0"/>
            <succ>
               <link type="nottaken" cfg="c6" bb="c6b3"/>
               <link type="taken" cfg="c6" bb="c6b4"/>
            </succ>
         </bb>
         <bb id="c6b3">
            <prec>
               <link type="nottaken" cfg="c6" bb="c6b2"/>
            </prec>
            <inst addr="0x400308C4"/>
            <inst addr="0x400308C8" src="s1" line="22"/>
            <inst addr="0x400308CC"/>
            <succ>
               <link type="call" cfg="c7" bb="c7b1"/>
               <link type="nottaken" cfg="c6" bb="c6b7"/>
            </succ>
         </bb>
         <bb id="c6b4">
            <prec>
               <link type="taken" cfg="c6" bb="c6b2"/>
            </prec>
            <inst addr="0x400308C4"/>
            <inst addr="0x400308EC" src="s1" line="29"/>
            <inst addr="0x400308F0"/>
            <inst addr="0x400308F4"/>
            <inst addr="0x400308F8" src="s1" line="30"/>
            <inst addr="0x400308FC"/>
            <succ>
               <link type="nottaken" cfg="c6" bb="c6b6"/>
            </succ>
         </bb>
         <bb id="c6b6">
            <prec>
               <link type="nottaken" cfg="c6" bb="c6b4"/>
               <link type="nottaken" cfg="c6" bb="c6b13"/>
            </prec>
            <inst addr="0x40030900"/>
            <inst addr="0x40030904"/>
            <inst addr="0x40030908"/>
            <succ>
               <link type="nottaken" cfg="c6" bb="c6b8"/>
               <link type="taken" cfg="c6" bb="c6b9"/>
            </succ>
         </bb>
         <bb id="c6b7">
            <prec>
               <link type="nottaken" cfg="c6" bb="c6b3"/>
            </prec>
            <inst addr="0x400308D0" src="s1" line="26"/>
            <inst addr="0x400308D4"/>
            <succ>
               <link type="call" cfg="c8" bb="c8b1"/>
               <link type="nottaken" cfg="c6" bb="c6b12"/>
            </succ>
         </bb>
         <bb id="c6b8">
            <prec>
               <link type="nottaken" cfg="c6" bb="c6b6"/>
            </prec>
            <inst addr="0x4003090C"/>
            <inst addr="0x40030910" src="s1" line="32"/>
            <inst addr="0x40030914"/>
            <succ>
               <link type="call" cfg="c9" bb="c9b1"/>
               <link type="nottaken" cfg="c6" bb="c6b13"/>
            </succ>
         </bb>
         <bb id="c6b9">
            <prec>
               <link type="taken" cfg="c6" bb="c6b6"/>
            </prec>
            <inst addr="0x4003090C"/>
            <inst addr="0x4003092C" src="s1" line="35"/>
            <inst addr="0x40030930"/>
            <inst addr="0x40030934"/>
            <inst addr="0x40030938" src="s1" line="11"/>
            <inst addr="0x4003093C" src="s1" line="37"/>
            <inst addr="0x40030940"/>
            <inst addr="0x40030944"/>
            <inst addr="0x40030948"/>
         </bb>
         <bb id="c6b12">
            <prec>
               <link type="nottaken" cfg="c6" bb="c6b7"/>
            </prec>
            <inst addr="0x400308D8" src="s1" line="16"/>
            <inst addr="0x400308DC"/>
            <inst addr="0x400308E0"/>
            <inst addr="0x400308E4" src="s1" line="28"/>
            <inst addr="0x400308E8"/>
            <succ>
               <link type="nottaken" cfg="c6" bb="c6b2"/>
            </succ>
         </bb>
         <bb id="c6b13">
            <prec>
               <link type="nottaken" cfg="c6" bb="c6b8"/>
            </prec>
            <inst addr="0x40030918" src="s1" line="30"/>
            <inst addr="0x4003091C"/>
            <inst addr="0x40030920"/>
            <inst addr="0x40030924" src="s1" line="33"/>
            <inst addr="0x40030928"/>
            <succ>
               <link type="nottaken" cfg="c6" bb="c6b6"/>
            </succ>
         </bb>
      </cfg>
      <cfg id="c7" name="xgnc__aocs">
         <bb id="c7b1">
            <prec>
               <link type="call" cfg="c6" bb="c6b3"/>
            </prec>
            <inst addr="0x40030710" src="s2" line="34"/>
            <inst addr="0x40030714" src="s2" line="38"/>
            <inst addr="0x40030718"/>
            <inst addr="0x4003071C"/>
            <inst addr="0x40030720"/>
            <inst addr="0x40030724"/>
            <inst addr="0x40030728"/>
            <inst addr="0x4003072C"/>
            <inst addr="0x40030730"/>
            <inst addr="0x40030734"/>
            <succ>
               <link type="call" cfg="c12" bb="c12b1"/>
               <link type="nottaken" cfg="c7" bb="c7b3"/>
            </succ>
         </bb>
         <bb id="c7b3">
            <prec>
               <link type="nottaken" cfg="c7" bb="c7b1"/>
            </prec>
            <inst addr="0x40030738" src="s2" line="40"/>
            <inst addr="0x4003073C"/>
            <inst addr="0x40030740"/>
            <inst addr="0x40030744"/>
            <inst addr="0x40030748"/>
            <inst addr="0x4003074C"/>
            <succ>
               <link type="call" cfg="c13" bb="c13b1"/>
               <link type="nottaken" cfg="c7" bb="c7b5"/>
            </succ>
         </bb>
         <bb id="c7b5">
            <prec>
               <link type="nottaken" cfg="c7" bb="c7b3"/>
            </prec>
            <inst addr="0x40030750" src="s2" line="44"/>
            <inst addr="0x40030754"/>
            <inst addr="0x40030758"/>
            <inst addr="0x4003075C"/>
            <inst addr="0x40030760"/>
            <inst addr="0x40030764"/>
            <inst addr="0x40030768"/>
            <inst addr="0x4003076C"/>
            <inst addr="0x40030770"/>
            <inst addr="0x40030774"/>
            <inst addr="0x40030778"/>
            <inst addr="0x4003077C"/>
            <inst addr="0x40030780"/>
            <succ>
               <link type="call" cfg="c14" bb="c14b1"/>
               <link type="nottaken" cfg="c7" bb="c7b7"/>
            </succ>
         </bb>
         <bb id="c7b7">
            <prec>
               <link type="nottaken" cfg="c7" bb="c7b5"/>
            </prec>
            <inst addr="0x40030784" src="s2" line="53"/>
            <inst addr="0x40030788"/>
            <inst addr="0x4003078C"/>
            <inst addr="0x40030790"/>
            <inst addr="0x40030794"/>
            <inst addr="0x40030798"/>
            <succ>
               <link type="call" cfg="c15" bb="c15b1"/>
               <link type="nottaken" cfg="c7" bb="c7b9"/>
            </succ>
         </bb>
         <bb id="c7b9">
            <prec>
               <link type="nottaken" cfg="c7" bb="c7b7"/>
            </prec>
            <inst addr="0x4003079C" src="s2" line="57"/>
            <inst addr="0x400307A0"/>
            <inst addr="0x400307A4"/>
            <inst addr="0x400307A8"/>
            <inst addr="0x400307AC"/>
            <inst addr="0x400307B0"/>
            <inst addr="0x400307B4"/>
            <inst addr="0x400307B8"/>
            <inst addr="0x400307BC"/>
            <inst addr="0x400307C0"/>
            <inst addr="0x400307C4"/>
            <succ>
               <link type="call" cfg="c16" bb="c16b1"/>
               <link type="nottaken" cfg="c7" bb="c7b11"/>
            </succ>
         </bb>
         <bb id="c7b11">
            <prec>
               <link type="nottaken" cfg="c7" bb="c7b9"/>
            </prec>
            <inst addr="0x400307C8" src="s2" line="61"/>
            <inst addr="0x400307CC"/>
            <inst addr="0x400307D0"/>
            <inst addr="0x400307D4"/>
            <inst addr="0x400307D8"/>
            <inst addr="0x400307DC"/>
            <inst addr="0x400307E0"/>
            <inst addr="0x400307E4"/>
            <inst addr="0x400307E8"/>
            <inst addr="0x400307EC"/>
            <inst addr="0x400307F0"/>
            <inst addr="0x400307F4"/>
            <inst addr="0x400307F8"/>
            <inst addr="0x400307FC"/>
            <inst addr="0x40030800"/>
            <inst addr="0x40030804"/>
            <inst addr="0x40030808"/>
            <inst addr="0x4003080C"/>
            <inst addr="0x40030810"/>
            <inst addr="0x40030814"/>
            <inst addr="0x40030818"/>
            <inst addr="0x4003081C"/>
            <inst addr="0x40030820"/>
            <inst addr="0x40030824"/>
            <inst addr="0x40030828"/>
            <inst addr="0x4003082C"/>
            <inst addr="0x40030830"/>
            <inst addr="0x40030834"/>
            <inst addr="0x40030838"/>
            <inst addr="0x4003083C"/>
            <inst addr="0x40030840"/>
            <inst addr="0x40030844"/>
            <inst addr="0x40030848"/>
            <inst addr="0x4003084C"/>
            <inst addr="0x40030850"/>
            <succ>
               <link type="call" cfg="c17" bb="c17b1"/>
               <link type="nottaken" cfg="c7" bb="c7b13"/>
            </succ>
         </bb>
         <bb id="c7b13">
            <prec>
               <link type="nottaken" cfg="c7" bb="c7b11"/>
            </prec>
            <inst addr="0x40030854" src="s2" line="69"/>
            <inst addr="0x40030858"/>
            <inst addr="0x4003085C"/>
         </bb>
      </cfg>
      <cfg id="c12" name="xgnc__guidance__gnc_q4_0_q3_0_q2_0_q1_0">
         <bb id="c12b1">
            <prec>
               <link type="call" cfg="c7" bb="c7b1"/>
            </prec>
            <inst addr="0x4002F670" src="s3" line="9"/>
            <inst addr="0x4002F674"/>
            <inst addr="0x4002F678"/>
            <inst addr="0x4002F67C" src="s3" line="12"/>
            <inst addr="0x4002F680"/>
            <inst addr="0x4002F684"/>
            <inst addr="0x4002F688"/>
            <inst addr="0x4002F68C"/>
            <inst addr="0x4002F690"/>
            <inst addr="0x4002F694"/>
            <succ>
               <link type="nottaken" cfg="c12" bb="c12b2"/>
               <link type="taken" cfg="c12" bb="c12b3"/>
            </succ>
         </bb>
         <bb id="c12b2">
            <prec>
               <link type="nottaken" cfg="c12" bb="c12b1"/>
            </prec>
            <inst addr="0x4002F698"/>
            <inst addr="0x4002F69C"/>
            <inst addr="0x4002F6A0"/>
            <succ>
               <link type="nottaken" cfg="c12" bb="c12b4"/>
            </succ>
         </bb>
         <bb id="c12b3">
            <prec>
               <link type="taken" cfg="c12" bb="c12b1"/>
            </prec>
            <inst addr="0x4002F698"/>
            <inst addr="0x4002F6A4" src="s3" line="13"/>
            <inst addr="0x4002F6A8"/>
            <inst addr="0x4002F6AC"/>
            <inst addr="0x4002F6B0"/>
            <inst addr="0x4002F6B4"/>
            <inst addr="0x4002F6B8" src="s3" line="14"/>
            <inst addr="0x4002F6BC"/>
            <inst addr="0x4002F6C0"/>
            <inst addr="0x4002F6C4"/>
            <inst addr="0x4002F6C8"/>
            <inst addr="0x4002F6CC" src="s3" line="15"/>
            <inst addr="0x4002F6D0"/>
            <inst addr="0x4002F6D4"/>
            <inst addr="0x4002F6D8"/>
            <inst addr="0x4002F6DC"/>
            <inst addr="0x4002F6E0" src="s3" line="16"/>
            <inst addr="0x4002F6E4"/>
            <inst addr="0x4002F6E8"/>
            <inst addr="0x4002F6EC"/>
            <inst addr="0x4002F6F0"/>
            <succ>
               <link type="nottaken" cfg="c12" bb="c12b4"/>
            </succ>
         </bb>
         <bb id="c12b4">
            <prec>
               <link type="nottaken" cfg="c12" bb="c12b2"/>
               <link type="nottaken" cfg="c12" bb="c12b3"/>
            </prec>
            <inst addr="0x4002F6F4" src="s3" line="18"/>
            <inst addr="0x4002F6F8"/>
            <inst addr="0x4002F6FC"/>
         </bb>
      </cfg>
      <cfg id="c13" name="xgnc__guidance__gnc_attitude_calculation_start">
         <bb id="c13b1">
            <prec>
               <link type="call" cfg="c7" bb="c7b3"/>
            </prec>
            <inst addr="0x4002F79C" src="s3" line="35"/>
            <inst addr="0x4002F7A0"/>
            <inst addr="0x4002F7A4"/>
            <inst addr="0x4002F7A8" src="s3" line="38"/>
            <inst addr="0x4002F7AC"/>
            <inst addr="0x4002F7B0"/>
            <succ>
               <link type="call" cfg="c21" bb="c21b1"/>
               <link type="nottaken" cfg="c13" bb="c13b3"/>
            </succ>
         </bb>
         <bb id="c13b3">
            <prec>
               <link type="nottaken" cfg="c13" bb="c13b1"/>
            </prec>
            <inst addr="0x4002F7B4" src="s3" line="39"/>
            <inst addr="0x4002F7B8"/>
            <inst addr="0x4002F7BC"/>
            <succ>
               <link type="call" cfg="c22" bb="c22b1"/>
               <link type="nottaken" cfg="c13" bb="c13b5"/>
            </succ>
         </bb>
         <bb id="c13b5">
            <prec>
               <link type="nottaken" cfg="c13" bb="c13b3"/>
            </prec>
            <inst addr="0x4002F7C0" src="s3" line="40"/>
            <inst addr="0x4002F7C4"/>
            <inst addr="0x4002F7C8"/>
         </bb>
      </cfg>
      <cfg id="c21" name="xgnc__guidance__gnc_attitude_calculation_disable">
         <bb id="c21b1">
            <prec>
               <link type="call" cfg="c13" bb="c13b1"/>
               <link type="call" cfg="c14" bb="c14b13"/>
            </prec>
            <inst addr="0x4002F77C" src="s3" line="30"/>
            <inst addr="0x4002F780"/>
            <inst addr="0x4002F784" src="s3" line="32"/>
            <inst addr="0x4002F788"/>
            <inst addr="0x4002F78C"/>
            <inst addr="0x4002F790" src="s3" line="33"/>
            <inst addr="0x4002F794"/>
            <inst addr="0x4002F798"/>
         </bb>
      </cfg>
      <cfg id="c22" name="xgnc__guidance__gnc_attitude_calculation_init">
         <bb id="c22b1">
            <prec>
               <link type="call" cfg="c13" bb="c13b3"/>
               <link type="call" cfg="c14" bb="c14b5"/>
            </prec>
            <inst addr="0x4002F700" src="s3" line="20"/>
            <inst addr="0x4002F704"/>
            <inst addr="0x4002F708" src="s3" line="22"/>
            <inst addr="0x4002F70C"/>
            <inst addr="0x4002F710"/>
            <inst addr="0x4002F714"/>
            <inst addr="0x4002F718"/>
            <inst addr="0x4002F71C" src="s3" line="23"/>
            <inst addr="0x4002F720"/>
            <inst addr="0x4002F724"/>
            <inst addr="0x4002F728"/>
            <inst addr="0x4002F72C"/>
            <inst addr="0x4002F730" src="s3" line="24"/>
            <inst addr="0x4002F734"/>
            <inst addr="0x4002F738"/>
            <inst addr="0x4002F73C"/>
            <inst addr="0x4002F740"/>
            <inst addr="0x4002F744" src="s3" line="25"/>
            <inst addr="0x4002F748"/>
            <inst addr="0x4002F74C"/>
            <inst addr="0x4002F750"/>
            <inst addr="0x4002F754"/>
            <inst addr="0x4002F758" src="s3" line="26"/>
            <inst addr="0x4002F75C"/>
            <inst addr="0x4002F760"/>
            <inst addr="0x4002F764" src="s3" line="27"/>
            <inst addr="0x4002F768"/>
            <inst addr="0x4002F76C"/>
            <inst addr="0x4002F770" src="s3" line="28"/>
            <inst addr="0x4002F774"/>
            <inst addr="0x4002F778"/>
         </bb>
      </cfg>
      <cfg id="c14" name="xgnc__guidance__gnc_attitude_calculation">
         <bb id="c14b1">
            <prec>
               <link type="call" cfg="c7" bb="c7b5"/>
            </prec>
            <inst addr="0x4002F7CC" src="s3" line="42"/>
            <inst addr="0x4002F7D0"/>
            <inst addr="0x4002F7D4"/>
            <inst addr="0x4002F7D8"/>
            <inst addr="0x4002F7DC"/>
            <inst addr="0x4002F7E0" src="s3" line="63"/>
            <inst addr="0x4002F7E4"/>
            <inst addr="0x4002F7E8"/>
            <inst addr="0x4002F7EC"/>
            <inst addr="0x4002F7F0"/>
            <inst addr="0x4002F7F4"/>
            <inst addr="0x4002F7F8"/>
            <inst addr="0x4002F7FC"/>
            <inst addr="0x4002F800"/>
            <inst addr="0x4002F804"/>
            <inst addr="0x4002F808"/>
            <inst addr="0x4002F80C"/>
            <inst addr="0x4002F810"/>
            <inst addr="0x4002F814"/>
            <inst addr="0x4002F818"/>
            <inst addr="0x4002F81C"/>
            <inst addr="0x4002F820" src="s3" line="64"/>
            <inst addr="0x4002F824"/>
            <inst addr="0x4002F828"/>
            <inst addr="0x4002F82C"/>
            <inst addr="0x4002F830" src="s3" line="65"/>
            <inst addr="0x4002F834"/>
            <inst addr="0x4002F838"/>
            <inst addr="0x4002F83C"/>
            <inst addr="0x4002F840" src="s3" line="66"/>
            <inst addr="0x4002F844"/>
            <inst addr="0x4002F848"/>
            <inst addr="0x4002F84C"/>
            <inst addr="0x4002F850"/>
            <inst addr="0x4002F854"/>
            <inst addr="0x4002F858"/>
            <inst addr="0x4002F85C"/>
            <inst addr="0x4002F860"/>
            <inst addr="0x4002F864"/>
            <inst addr="0x4002F868"/>
            <inst addr="0x4002F86C"/>
            <inst addr="0x4002F870"/>
            <inst addr="0x4002F874"/>
            <inst addr="0x4002F878"/>
            <inst addr="0x4002F87C"/>
            <inst addr="0x4002F880" src="s3" line="67"/>
            <inst addr="0x4002F884"/>
            <inst addr="0x4002F888"/>
            <inst addr="0x4002F88C"/>
            <inst addr="0x4002F890"/>
            <inst addr="0x4002F894"/>
            <inst addr="0x4002F898"/>
            <inst addr="0x4002F89C"/>
            <inst addr="0x4002F8A0"/>
            <inst addr="0x4002F8A4"/>
            <inst addr="0x4002F8A8"/>
            <inst addr="0x4002F8AC"/>
            <inst addr="0x4002F8B0"/>
            <inst addr="0x4002F8B4"/>
            <inst addr="0x4002F8B8"/>
            <inst addr="0x4002F8BC"/>
            <inst addr="0x4002F8C0" src="s3" line="68"/>
            <inst addr="0x4002F8C4"/>
            <inst addr="0x4002F8C8"/>
            <inst addr="0x4002F8CC"/>
            <inst addr="0x4002F8D0" src="s3" line="69"/>
            <inst addr="0x4002F8D4"/>
            <inst addr="0x4002F8D8"/>
            <inst addr="0x4002F8DC"/>
            <inst addr="0x4002F8E0" src="s3" line="70"/>
            <inst addr="0x4002F8E4"/>
            <inst addr="0x4002F8E8"/>
            <inst addr="0x4002F8EC"/>
            <inst addr="0x4002F8F0" src="s3" line="71"/>
            <inst addr="0x4002F8F4"/>
            <inst addr="0x4002F8F8"/>
            <inst addr="0x4002F8FC"/>
            <inst addr="0x4002F900" src="s3" line="72"/>
            <inst addr="0x4002F904"/>
            <inst addr="0x4002F908"/>
            <inst addr="0x4002F90C"/>
            <inst addr="0x4002F910" src="s3" line="73"/>
            <inst addr="0x4002F914"/>
            <inst addr="0x4002F918"/>
            <inst addr="0x4002F91C"/>
            <inst addr="0x4002F920" src="s3" line="75"/>
            <inst addr="0x4002F924"/>
            <inst addr="0x4002F928"/>
            <inst addr="0x4002F92C"/>
            <inst addr="0x4002F930"/>
            <inst addr="0x4002F934"/>
            <inst addr="0x4002F938"/>
            <succ>
               <link type="nottaken" cfg="c14" bb="c14b2"/>
               <link type="taken" cfg="c14" bb="c14b3"/>
            </succ>
         </bb>
         <bb id="c14b2">
            <prec>
               <link type="nottaken" cfg="c14" bb="c14b1"/>
            </prec>
            <inst addr="0x4002F93C"/>
            <inst addr="0x4002F940"/>
            <inst addr="0x4002F944"/>
            <inst addr="0x4002F95C" src="s3" line="78"/>
            <succ>
               <link type="nottaken" cfg="c14" bb="c14b4"/>
            </succ>
         </bb>
         <bb id="c14b3">
            <prec>
               <link type="taken" cfg="c14" bb="c14b1"/>
            </prec>
            <inst addr="0x4002F93C"/>
            <inst addr="0x4002F948" src="s3" line="76"/>
            <inst addr="0x4002F94C"/>
            <inst addr="0x4002F950"/>
            <inst addr="0x4002F954"/>
            <inst addr="0x4002F958"/>
            <succ>
               <link type="nottaken" cfg="c14" bb="c14b4"/>
            </succ>
         </bb>
         <bb id="c14b4">
            <prec>
               <link type="nottaken" cfg="c14" bb="c14b2"/>
               <link type="nottaken" cfg="c14" bb="c14b3"/>
            </prec>
            <inst addr="0x4002F960" src="s3" line="81"/>
            <inst addr="0x4002F964"/>
            <inst addr="0x4002F968"/>
            <inst addr="0x4002F96C"/>
            <succ>
               <link type="nottaken" cfg="c14" bb="c14b5"/>
               <link type="taken" cfg="c14" bb="c14b6"/>
            </succ>
         </bb>
         <bb id="c14b5">
            <prec>
               <link type="nottaken" cfg="c14" bb="c14b4"/>
            </prec>
            <inst addr="0x4002F970"/>
            <inst addr="0x4002F974" src="s3" line="82"/>
            <inst addr="0x4002F978"/>
            <inst addr="0x4002F97C"/>
            <succ>
               <link type="call" cfg="c22" bb="c22b1"/>
               <link type="nottaken" cfg="c14" bb="c14b10"/>
            </succ>
         </bb>
         <bb id="c14b6">
            <prec>
               <link type="taken" cfg="c14" bb="c14b4"/>
            </prec>
            <inst addr="0x4002F970"/>
            <inst addr="0x4002F9BC" src="s3" line="84"/>
            <inst addr="0x4002F9C0"/>
            <inst addr="0x4002F9C4"/>
            <inst addr="0x4002F9C8"/>
            <succ>
               <link type="nottaken" cfg="c14" bb="c14b8"/>
               <link type="taken" cfg="c14" bb="c14b9"/>
            </succ>
         </bb>
         <bb id="c14b8">
            <prec>
               <link type="nottaken" cfg="c14" bb="c14b6"/>
            </prec>
            <inst addr="0x4002F9CC"/>
            <inst addr="0x4002F9D0" src="s3" line="85"/>
            <inst addr="0x4002F9D4"/>
            <inst addr="0x4002F9D8"/>
            <inst addr="0x4002F9DC"/>
            <inst addr="0x4002F9E0" src="s3" line="86"/>
            <inst addr="0x4002F9E4"/>
            <inst addr="0x4002F9E8"/>
            <inst addr="0x4002F9EC"/>
            <inst addr="0x4002F9F0" src="s3" line="87"/>
            <inst addr="0x4002F9F4"/>
            <inst addr="0x4002F9F8"/>
            <inst addr="0x4002F9FC"/>
            <inst addr="0x4002FA00" src="s3" line="88"/>
            <inst addr="0x4002FA04"/>
            <inst addr="0x4002FA08"/>
            <inst addr="0x4002FA0C"/>
            <inst addr="0x4002FA10" src="s3" line="89"/>
            <inst addr="0x4002FA14"/>
            <inst addr="0x4002FA18" src="s3" line="90"/>
            <inst addr="0x4002FA1C"/>
            <inst addr="0x4002FA20"/>
            <inst addr="0x4002FA24" src="s3" line="91"/>
            <inst addr="0x4002FA28"/>
            <inst addr="0x4002FA2C"/>
            <inst addr="0x4002FA30"/>
            <inst addr="0x4002FA34"/>
            <inst addr="0x4002FA38" src="s3" line="92"/>
            <inst addr="0x4002FA3C"/>
            <inst addr="0x4002FA40"/>
            <inst addr="0x4002FA44"/>
            <inst addr="0x4002FA48"/>
            <inst addr="0x4002FA4C" src="s3" line="93"/>
            <inst addr="0x4002FA50"/>
            <inst addr="0x4002FA54"/>
            <inst addr="0x4002FA58"/>
            <inst addr="0x4002FA5C"/>
            <inst addr="0x4002FA60" src="s3" line="94"/>
            <inst addr="0x4002FA64"/>
            <inst addr="0x4002FA68"/>
            <inst addr="0x4002FA6C"/>
            <inst addr="0x4002FA70"/>
            <inst addr="0x4002FA74"/>
            <inst addr="0x4002FA78"/>
            <inst addr="0x4002FA7C"/>
            <inst addr="0x4002FA80"/>
            <inst addr="0x4002FA84"/>
            <inst addr="0x4002FA88"/>
            <inst addr="0x4002FA8C"/>
            <inst addr="0x4002FA90"/>
            <inst addr="0x4002FA94" src="s3" line="95"/>
            <inst addr="0x4002FA98"/>
            <inst addr="0x4002FA9C"/>
            <inst addr="0x4002FAA0"/>
            <inst addr="0x4002FAA4" src="s3" line="96"/>
            <inst addr="0x4002FAA8"/>
            <inst addr="0x4002FAAC"/>
            <inst addr="0x4002FAB0"/>
            <inst addr="0x4002FAB4"/>
            <inst addr="0x4002FAB8"/>
            <inst addr="0x4002FABC"/>
            <inst addr="0x4002FAC0"/>
            <inst addr="0x4002FAC4" src="s3" line="97"/>
            <inst addr="0x4002FAC8"/>
            <inst addr="0x4002FACC"/>
            <inst addr="0x4002FAD0"/>
            <inst addr="0x4002FAD4"/>
            <inst addr="0x4002FAD8"/>
            <inst addr="0x4002FADC"/>
            <inst addr="0x4002FAE0"/>
            <inst addr="0x4002FAE4" src="s3" line="98"/>
            <inst addr="0x4002FAE8"/>
            <inst addr="0x4002FAEC"/>
            <inst addr="0x4002FAF0"/>
            <inst addr="0x4002FAF4"/>
            <inst addr="0x4002FAF8"/>
            <inst addr="0x4002FAFC" src="s3" line="99"/>
            <inst addr="0x4002FB00"/>
            <inst addr="0x4002FB04"/>
            <inst addr="0x4002FB08"/>
            <inst addr="0x4002FB0C"/>
            <inst addr="0x4002FB10"/>
            <inst addr="0x4002FB14"/>
            <succ>
               <link type="nottaken" cfg="c14" bb="c14b11"/>
               <link type="taken" cfg="c14" bb="c14b12"/>
            </succ>
         </bb>
         <bb id="c14b9">
            <prec>
               <link type="taken" cfg="c14" bb="c14b6"/>
            </prec>
            <inst addr="0x4002F9CC"/>
            <inst addr="0x4002FC38" src="s3" line="113"/>
            <inst addr="0x4002FC3C"/>
            <inst addr="0x4002FC40"/>
            <inst addr="0x4002FC44"/>
            <succ>
               <link type="nottaken" cfg="c14" bb="c14b13"/>
               <link type="taken" cfg="c14" bb="c14b14"/>
            </succ>
         </bb>
         <bb id="c14b10">
            <prec>
               <link type="nottaken" cfg="c14" bb="c14b5"/>
            </prec>
            <inst addr="0x4002F980" src="s3" line="83"/>
            <inst addr="0x4002F984"/>
            <inst addr="0x4002F988"/>
            <inst addr="0x4002F98C"/>
            <inst addr="0x4002F990"/>
            <inst addr="0x4002F994"/>
            <inst addr="0x4002F998"/>
            <inst addr="0x4002F99C"/>
            <inst addr="0x4002F9A0"/>
            <inst addr="0x4002F9A4"/>
            <inst addr="0x4002F9A8"/>
            <inst addr="0x4002F9AC"/>
            <inst addr="0x4002F9B0"/>
            <inst addr="0x4002F9B4"/>
            <inst addr="0x4002F9B8"/>
            <succ>
               <link type="nottaken" cfg="c14" bb="c14b15"/>
            </succ>
         </bb>
         <bb id="c14b11">
            <prec>
               <link type="nottaken" cfg="c14" bb="c14b8"/>
            </prec>
            <inst addr="0x4002FB18"/>
            <inst addr="0x4002FB1C"/>
            <inst addr="0x4002FB20"/>
            <inst addr="0x4002FB38" src="s3" line="102"/>
            <inst addr="0x4002FB3C"/>
            <succ>
               <link type="nottaken" cfg="c14" bb="c14b16"/>
            </succ>
         </bb>
         <bb id="c14b12">
            <prec>
               <link type="taken" cfg="c14" bb="c14b8"/>
            </prec>
            <inst addr="0x4002FB18"/>
            <inst addr="0x4002FB24" src="s3" line="100"/>
            <inst addr="0x4002FB28"/>
            <inst addr="0x4002FB2C"/>
            <inst addr="0x4002FB30"/>
            <inst addr="0x4002FB34"/>
            <succ>
               <link type="nottaken" cfg="c14" bb="c14b16"/>
            </succ>
         </bb>
         <bb id="c14b13">
            <prec>
               <link type="nottaken" cfg="c14" bb="c14b9"/>
            </prec>
            <inst addr="0x4002FC48"/>
            <inst addr="0x4002FC4C" src="s3" line="114"/>
            <inst addr="0x4002FC50"/>
            <inst addr="0x4002FC54"/>
            <succ>
               <link type="call" cfg="c21" bb="c21b1"/>